{
  "schema_version": "campaign-v1",
  "campaign_id": "20260711-plan3-operational-red-team-b960841d9-race",
  "plan": "plan3",
  "name": "race-and-shared-state",
  "started_at": "2026-07-11T05:59:58.729208Z",
  "completed_at": "2026-07-11T06:00:07.146962Z",
  "complete": true,
  "provenance": {
    "architecture": "arm64",
    "cache_mode": "count=1",
    "cpu_count": 14,
    "cpu_model": "Apple M4 Max",
    "dirty_worktree": true,
    "generator_version": "plan3-hostile-input-v1",
    "git_revision": "b960841d9",
    "go_version": "go1.26.4",
    "os": "darwin",
    "patch_sha256": "67c18a41711679774a5d70176f263105c77ef3e15b8192b3e796f443ab863812",
    "profile_version": "plan3-operational-v1",
    "race_enabled": true,
    "rapid_version": "v1.3.0",
    "temporal_api_version": "v1.63.3",
    "timezone_version": "tzcode-2022g-host-data",
    "work_definition_version": "v1/validator-v1/context-check-v1"
  },
  "population": "curated",
  "planned_cases": 5,
  "completed_cases": 5,
  "commands": [
    "timeout 600s go test -race -tags test_dep ./service/worker/scheduler/propertytest -run '^TestOperationalRace' -count=1"
  ],
  "environment": {
    "GOMAXPROCS": "default",
    "cache_modes": "cached,uncached"
  },
  "artifacts": [
    {
      "path": "cases.jsonl",
      "bytes": 8449,
      "sha256": "9e45c11cfe9697130a23f2ca859b9ad1a336472384fa7fc39c0cf4f65f488de7"
    },
    {
      "path": "summary.json",
      "bytes": 221,
      "sha256": "cb935d7bb74d0047ffcf3c270ba50d2a6d21585f5c91f359e6665c054c1387d2"
    },
    {
      "path": "RESULTS.md",
      "bytes": 193,
      "sha256": "9305b24f7dd8e67fd4a560b65d1a87b5af72988fcdd51859689f635aa2d6e396"
    },
    {
      "path": "race.txt",
      "bytes": 72,
      "sha256": "e5afa3a0afa3ec00c2a56481a66ac50111e3023ef3fcd5809d34c620ab3b70c4"
    }
  ]
}
