{
  "schema_version": "campaign-v1",
  "campaign_id": "20260710-plan2-uniform-distribution-872e129a8",
  "plan": "plan2",
  "name": "uniform-property-distribution",
  "started_at": "2026-07-11T03:45:48.223446Z",
  "completed_at": "2026-07-11T03:45:49.568653Z",
  "complete": true,
  "provenance": {
    "architecture": "arm64",
    "cache_mode": "count=1",
    "cpu_count": 14,
    "cpu_model": "Apple M4 Max",
    "dirty_worktree": true,
    "generator_version": "plan2-objective-search-v1",
    "git_revision": "872e129a827d88ce442dadcd24338013ebc052a6",
    "go_version": "go1.26.4",
    "os": "darwin",
    "patch_sha256": "9a0abe5205f28186899f1cfc6983b708679e4efb4ba38359e393cfb7c6544e01",
    "profile_version": "plan2-query-profiles-v1",
    "race_enabled": false,
    "rapid_version": "v1.3.0",
    "temporal_api_version": "v1.63.3",
    "timezone_version": "tzcode-2022g-host-data",
    "work_definition_version": "v1/validator-v1"
  },
  "population": "uniform-generated",
  "completed_cases": 6,
  "seeds": [
    "20260710"
  ],
  "commands": [
    "timeout 300s go test -tags test_dep ./service/worker/scheduler/propertytest -run '^TestPlan2UniformDistributionCampaign$' -count=1"
  ],
  "environment": {
    "SCHEDULE_PROPERTY_CAMPAIGN_ID": "20260710-plan2-uniform-distribution-872e129a8",
    "SCHEDULE_PROPERTY_DISTRIBUTION_CAMPAIGN": "1",
    "SCHEDULE_PROPERTY_RESULTS_DIR": "/tmp/schedule-property-plan2",
    "population_definition": "six-valid-seeds-x-twelve-mutations-v1"
  },
  "artifacts": [
    {
      "path": "cases.jsonl",
      "bytes": 643145,
      "sha256": "d7602c1c63c51ca8499b8053770505acfe89f50ce2b288b164214f333d986519"
    },
    {
      "path": "summary.json",
      "bytes": 946,
      "sha256": "16692b081a7fbd52e146516281cedf97c7921085619b32e144c5727d3e6a5589"
    },
    {
      "path": "RESULTS.md",
      "bytes": 710,
      "sha256": "05abcaf864025dd0cfdadebb12388c154c8257822563531915fab50c9d2269ad"
    }
  ]
}
